doi,title,venue,publication_year,content_type,abstract,keywords,science gateway | scientific gateway,virtual laboratory | Vlab,virtual research environment,more than one
10.1145/2467696.2467779,The Open Parks Network,ACM/IEEE-CS joint conference on Digital libraries,2013,Conference Paper,"The goal of the Open Parks Network (OPN) is to create a portal that connects park managers, researchers, policy makers, and citizens to each other and to valuable cultural resources related. Led by Clemson University in collaboration with the National Parks Service and Purdue University, OPN is designed to provide a virtual community of professionals in parks and protected areas with the tools, resources, and knowledge base they need to conduct intensive research, perform their jobs duties effectively, and share information with colleagues and users on an international scale. To date, 80,000 of 200,000 archival images and 500,000 out of 2 million bound pages have been digitized from various parks, and a beta version of the platform will be available for demonstration in March 2013. The project includes the integration of a Fedora repository with the Joomla! content management system with extensions to enable GIS functionality, expose metadata as Linked Data and for harvest using OAI-PMH, and enable users to create their own custom collections.","mass digitization, open parks network, virtual research environments",0,0,1,1
10.1109/CBMS.2016.32,Towards a Biomedical Virtual Research Environment,Proceedings - IEEE Symposium on Computer-Based Medical Systems,2016,Conference Paper,"Providing an appropriate level of accessibility to and tracking of data and process elements in large volumes of medical data is essential. Researchers require systems that provide traceability of information through provenance data capture and management to support clinical analyses. A Virtual Research Environment (VRE) in which data sets and workflows are described, captured, managed and instantiated across biomedical applications would provide an ideal platform for supporting collaborative analyses acting as a knowledge repository for research. We propose a solution that aims to provide detailed data and process traceability to support research analysis that is generically applicable across medical systems. © 2016 IEEE.","Biomedical Analysis, provenance, virtual research environments, workflows",0,0,1,1
10.1109/COMPSACW.2011.53,Towards a Generic Cloud-Based Virtual Research Environment,IEEE Annual Computer Software and Applications Conference Workshops,2011,Conference Paper,"Virtual collaboration is an important aspect for the success of scientific projects, especially if participating researchers are distributed over the whole globe. In the recent past some systems - so called virtual research environments - were presented to support collaborative work restricted to certain research domains. Within this article a concept of a generic framework for building personal, cloud-based virtual research environments easily is proposed. Such an environment could be defined by composing arbitrary services, appropriate to the requirements of a particular scientist. Due to low funds in some scientific areas, we also provide a flexible billing strategy using the cloud specific pay-per-use model. Thus, each service has just to be paid as long as it is utilized. © 2011 IEEE.","cloud computing, Layered Architecture, Pay-per-use, Virtual Collaboration, virtual research environments, virtualization",0,0,1,1
10.1109/CSCWD.2015.7231002,A crowdsourcing approach to the design of Virtual Research Environments,IEEE International Conference on Computer Supported Cooperative Work in Design,2015,Conference Paper,"A Species List of Flora is a working list of scientific descriptions of all known plants occurring within a given region. It represents an inventory in process, i.e., updates and new plant species are added every working day. The Flora checklist has an important value for the scientific community, government, industry and society, since it gathers accurate data on flora diversity. Knowing the Brazilian flora has been a commitment assumed by Brazil towards the international community. In 2009, the Rio de Janeiro Botanical Garden, in a joint action with several research institutions, started the development of a Virtual Research Environment based on crowdsourcing. The aim of the project was to support the collaborative and distributed work of an undefined number of pre-qualified trained taxonomists, grouped in their specialties. This article describes the technological aspects related to the ongoing work on the List of Species of the Brazilian Flora, which is a recent example of success in building a knowledge database collaboratively. It describes the mechanisms used for determining individual characteristics of potential participants (target audience), the means of collaboration and communication, as well as the technological platform developed to support a web-based crowdsourcing design for Virtual Research Environment. Some information on both the performance of the team of about 600 researchers and the quality of information produced are presented, also including some of the lessons learned and recommendations for future action. © 2015 IEEE.","collaboration, crowdsourcing, CSCW, plant checklists, virtual research environments",0,0,1,1
10.1109/eScience.2011.9,A Virtual Research Environment for Cancer Imaging Research,International Conference on e-Science,2011,Conference Paper,"The ""Virtual Research Environment for Cancer Imaging"" project aims to support image processing researchers and clinicians by providing a framework for sharing images and algorithms. In this paper we present the system developed to date which has focused on sharing and managing DICOM images using Microsoft's Share Point 2010. The system allows configuring the metadata to be extracted from the DICOM tags to meet requirements from both set of users: imaging researchers and clinicians. We present the work conducted to allow sharing algorithms as scientific workflows through the use of the Trident Workflow Workbench and the initial library of activities and workflows created for one of the most popular image processing toolkits among imaging researchers, the Insight Toolkit. © 2011 IEEE.","Cancer Imaging, Insight Toolkit, SharePoint 2010, Trident Workflow Workbench, virtual research environments",0,0,1,1
10.1109/eScience.2018.00124,Serving Scientists in Agri-Food Area by Virtual Research Environments,International Conference on e-Science,2018,Conference Paper,"Agri-food research calls for changes in the practices dealing with data collection, collation, processing and analytics, and publishing thus to fully benefit from and contribute to the Open Science movement. One of the major issues faced by the agri-food researchers is the fragmentation of the 'assets' that can be exploited when performing research tasks, e.g. data of interest are heterogeneous and scattered across several repositories, the tools exploited by modellers are diverse and often rely on local computing environments, the publishing practices are various and rarely aim at making available the 'whole story' with datasets, processes, workflows. This paper presents the AGINFRA+ endeavour to overcome these limitations by providing researchers in three designated communities with Virtual Research Environments facilitating the access to and use of the 'assets' of interest and promote collaboration. © 2018 IEEE.","agroclimatic modeling, e-infrastructures, Food Safety, food security, virtual research environments",0,0,1,1
10.1109/ICDMW.2017.99,A Virtual Research Environment to Support Remote Behaviour Monitoring from Data Collection to Analysis,IEEE International Conference on Data Mining Workshops,2017,Conference Paper,"Virtual research environments (VRE) allow to collaboratively work on research projects. Typically, they provide a web-based interface to share documents and data for analysis. However, currently there is no support for earlier stages of research projects in the context of behaviour monitoring such as data collection. With the rise of solutions based on information and communication technologies (ICT), the number of clinical studies using such technologies increases. Thus, the need to support collaboration during earlier project phases increases as data collection has to be monitored remotely. We developed a VRE to provide support during all phases of ICT based studies. During a study on agitated behaviour of people with dementia based on ICT solutions, we employed this VRE. In this paper, we describe the VRE and its features with respect to the research project. © 2017 IEEE.","Alzheimer, data analysis, Dementia, virtual research environments, Wearables",0,0,1,1
10.1002/cpe.3238,Supporting biodiversity studies with the EUBrazilOpenBio Hybrid Data Infrastructure,Concurrency and Computation: Practice and Experience,2015,Article,"SummaryEUBrazilOpenBio is a collaborative initiative addressing strategic barriers in biodiversity research by integrating open access data and user-friendly tools widely available in Brazil and Europe. The project deploys the EU-Brazil Hybrid Data Infrastructure that allows the sharing of hardware, software and data on-demand. This infrastructure provides access to several integrated services and resources to seamlessly aggregate taxonomic, biodiversity and climate data, used by processing services implementing checklist cross-mapping and ecological niche modelling. A Virtual Research Environment was created to provide users with a single entry point to processing and data resources. This article describes the architecture, demonstration use cases and some experimental results and validation. Copyright © 2014 John Wiley & Sons, Ltd. Copyright © 2014 John Wiley & Sons, Ltd.","biodiversity, clouds, data infrastructure, ecological niche modelling, taxonomy, virtual research environments",0,0,1,1
10.1002/cpe.3524,Reflections on science gateways sustainability through the business model canvas: Case study of a neuroscience gateway,Concurrency and Computation: Practice and Experience,2015,Article,"The sustainability of science gateways has been a topic of active discussion because they have been created and supported in the context of temporary research and infrastructure projects. As successful projects come to an end, it is necessary to find (new) models to secure continuous exploitation of products generated by these projects. Taking this step requires business considerations that are not trivial to do from the role of a researcher. This paper presents our experiences in adopting a methodology from lean business development, the Business Model Canvas (BMC). This methodology enables structured reflection upon the business model and facilitates exploring alternative ones (pivoting). We have applied the BMC to one of the science gateways designed, developed, and operated by the Academic Medical Center (AMC) e-Science group: the AMC Computational Neuroscience Gateway. The current gateway BMC is explained in the paper and used as basis for a reflection to improve its sustainability. Alternative business models are given as examples of BMC iteration or pivots. This exercise helped us to structure the various aspects to be considered when designing or reflecting upon the business model of our gateway. It also facilitated the visualization of the complete business picture and helps the reflection about improvements in the business model toward sustainability. We believe that this methodology could be valuable also for the reflection about sustainability of other science gateways that are growing from academic groups that do not have business training. © 2015 John Wiley & Sons, Ltd.","Business Model Canvas (BMC), science gateways, sustainability, virtual research environments",1,0,1,2
10.1002/cpe.5028,Reconstructing 3D virtual environments within a collaborative e-infrastructure,Concurrency and Computation: Practice and Experience,2019,Article,"Sets of two-dimensional images are insufficient to capture the development in time and space of three-dimensional structures. The 2D “flattening” of photographs results in a significant loss of features especially if the photos were taken by one person. Automatically collecting and aligning photos in order to render 3D structures from 2D images without specialised equipment is currently a complex process that requires specialist knowledge with often limited results. In this paper, an Open Science oriented workflow is proposed where an on-line file system is used to share photos of an object or an environment and to produce a virtual reality scene as a navigable 3D reconstruction that can be shared with other people. Our workflow is based on a distributed e-Infrastructure and overcomes common limitations of other approaches by having all the used technology integrated on the same platform and by not requiring specialist knowledge. A performance evaluation of the 3D reconstruction process embedded in the workflow is reported against a commercial software and an open-source software in terms of computational efficiency and reconstruction accuracy, and three marine science use cases are reported to show potential applications of the workflow. © 2018 John Wiley & Sons, Ltd.","3D reconstruction, cloud computing, e-infrastructures, open science, photogrammetry, photography, virtual reality, virtual research environments",0,0,1,1
10.1002/cpe.5269,Time-critical data management in clouds: Challenges and a Dynamic Real-Time Infrastructure Planner (DRIP) solution,Concurrency and Computation: Practice and Experience,2020,Conference Paper,"The increasing volume of data being produced, curated, and made available by research infrastructures in the environmental science domain require services that are able to optimize the delivery and staging of data for researchers and other users of scientific data. Specialized data services for managing data life cycle, for creating and delivering data products, and for customized data processing and analysis all play a crucial role in how these research infrastructures serve their communities, and many of these activities are time-critical—needing to be carried out frequently within specific time windows. We describe our experiences identifying the time-critical requirements of environmental scientists making use of computational research support environments. We present a microservice-based infrastructure optimization suite, the Dynamic Real-Time Infrastructure Planner, used for constructing virtual infrastructures for research applications on demand. We provide a case study whereby our suite is used to optimize runtime service quality for a data subscription service provided by the Euro-Argo using EGI Federated Cloud and EUDAT's B2SAFE services, and to consider how such a case study relates to other application scenarios. © 2019 The Authors Concurrency and Computation: Practice and Experience Published by John Wiley & Sons Ltd.","Dynamic Real-Time Infrastructure Planner, e-infrastructures, research infrastructures, time-critical services, virtual research environments",0,0,1,1
10.1002/cpe.6087,Realizing virtual research environments for the agri-food community: The AGINFRA PLUS experience,Concurrency and Computation: Practice and Experience,2021,Article,"The enhancements in IT solutions and the open science movement are injecting changes in the practices dealing with data collection, collation, processing, analytics, and publishing in all the domains, including agri-food. However, in implementing these changes one of the major issues faced by the agri-food researchers is the fragmentation of the “assets” to be exploited when performing research tasks, for example, data of interest are heterogeneous and scattered across several repositories, the tools modelers rely on are diverse and often make use of limited computing capacity, the publishing practices are various and rarely aim at making available the “whole story” including datasets, processes, and results. This paper presents the AGINFRA PLUS endeavor to overcome these limitations by providing researchers in three designated communities with Virtual Research Environments facilitating the use of the “assets” of interest and promote collaboration. © 2020 John Wiley & Sons Ltd","agroclimatic modeling, food safety risks assessment, food security, virtual research environments",0,0,1,1
10.1002/cpe.6099,Measuring success for a future vision: Defining impact in science gateways/virtual research environments,Concurrency and Computation: Practice and Experience,2021,Article,"Scholars worldwide leverage science gateways/virtual research environments (VREs) for a wide variety of research and education endeavors spanning diverse scientific fields. Evaluating the value of a given science gateway/VRE to its constituent community is critical in obtaining the financial and human resources necessary to sustain operations and increase adoption in the user community. In this article, we feature a variety of exemplar science gateways/VREs and detail how they define impact in terms of, for example, their purpose, operation principles, and size of user base. Further, the exemplars recognize that their science gateways/VREs will continuously evolve with technological advancements and standards in cloud computing platforms, web service architectures, data management tools and cybersecurity. Correspondingly, we present a number of technology advances that could be incorporated in next-generation science gateways/VREs to enhance their scope and scale of their operations for greater success/impact. The exemplars are selected from owners of science gateways in the Science Gateways Community Institute (SGCI) clientele in the United States, and from the owners of VREs in the International Virtual Research Environment Interest Group (VRE-IG) of the Research Data Alliance. Thus, community-driven best practices and technology advances are compiled from diverse expert groups with an international perspective to envisage futuristic science gateway/VRE innovations. © 2020 John Wiley & Sons, Ltd.","futuristic vision, measuring impact, science gateways, success metrics, virtual research environments",1,0,1,2
10.1002/hbe2.223,SCD-MVA: A mobile application for conducting single-case experimental design research during the pandemic,Human Behavior and Emerging Technologies,2021,Article,"The COVID-19 outbreak emphasizes the need for alternative methods for data gathering and collaboration among researchers in a virtual research environment. One experimental design that is well suited in a social distancing research context is the single-case experimental design (SCD). SCDs can handle disruptions as (a) they do not require large groups gathering for data collection or intervention administration, (b) interventions are administered individually and in some cases remotely, (c) no comparison group is needed, and (d) they are adaptive and flexible designs. The purpose of this article is to introduce the mobile application, SCD-MVA (2019), developed to assists in the design of an SCD, data gathering, data analysis, and remote collaboration. The application allows data management and data sharing among researchers, provides an in real time visualization of the gathered data, stimulates interaction between researchers in terms of designing the SCD, gathering the data, and analyzing the gathered data, and does all these things with no need for in-person meetings of the research team. © 2020 Wiley Periodicals LLC.","masked visual analysis, multiple baseline design, single-case experimental design, “SCD-MVA” mobile application",0,0,1,1
10.1002/pra2.2018.14505501126,"Digital humanities, libraries, and crowdsourcing: Foundations of digital textual technologies",Association for Information Science and Technology,2018,Article,"The Greek Key is a prototype Virtual Research Environment (VRE) for the analysis of patterns in ancient texts and manuscripts. A Powerpoint presentation demonstrates how the VRE functions through a comparative case study of the organization of information in Plato and Aristotle. The interdisciplinary method combines historical, philological, and philosophical techniques with approaches from the digital humanities. The Greek Key is a collaborative, scalable, multidisciplinary project that has the potential to engage librarians in participatory strategies such as crowdsourcing (or “Citizen Science”). The Greek Key tools for visualizing textual data have the potential to: reveal previously undetected patterns in books and collections; make connections among different works; help users bring new information to bear on interpretation; demonstrate the significance of findings; and generate fresh insights about works of literature that have had a central and enduring influence on both our scholarly traditions and the history of libraries and librarianship. The VRE will make it possible for academic researchers and librarians to pursue perennial questions in innovative ways, and respond to questions that do not lend themselves to more traditional methods. Copyright © 2018 by Association for Information Science and Technology","Aristotle, citizen science, crowdsourcing, digital humanities, historical and philosophical foundations of library and information science, Plato, text analysis, virtual research environments",0,0,1,1
10.1007/978-3-030-06016-9_6,Towards research infrastructures that curate scientific information: A use case in life sciences,Lecture Notes in Computer Science ,2019,Conference Paper,"Scientific information communicated in scholarly literature remains largely inaccessible to machines. The global scientific knowledge base is little more than a collection of (digital) documents. The main reason is in the fact that the document is the principal form of communication and—since underlying data, software and other materials mostly remain unpublished—the fact that the scholarly article is, essentially, the only form used to communicate scientific information. Based on a use case in life sciences, we argue that virtual research environments and semantic technologies are transforming the capability of research infrastructures to systematically acquire and curate machine readable scientific information communicated in scholarly literature. © Springer Nature Switzerland AG 2019.","Knowledge infrastructures, Knowledge representation, research infrastructures, Scholarly communication, Scientific information, virtual research environments",0,0,1,1
10.1007/978-3-030-39815-6_11,Using Virtual Research Environments in Agro-Environmental Research,International Symposium on Environmental Software Systems,2020,Conference Paper,"Tackling some of the grand global challenges, agro-environmental research has turned more and more into an international venture, where distributed research teams work together to solve complex research questions. Moreover, the interdisciplinary character of these challenges requires that a large diversity of different data sources and information is combined in new, innovative ways. There is a pressing need to support researchers with environments that allow them to efficiently work together and co-develop research. As research is often data-intensive, and big data becomes a common part of a lot of research, such environments should also offer the resources, tools and workflows that allow to process data at scale if needed. Virtual research environments (VRE), which combine working in the Cloud, with collaborative functions and state of the art data science tools, can be a potential solution. In the H2020 AGINFRA+ project, the usability of the VREs has been explored for use cases around agro-climatic modelling. The implemented pilot application for crop growth modelling has successfully shown that VREs can support distributed research teams in co-development, helps them to adopt open science and that the VRE’s cloud computing facilities allow large scale modelling applications. © 2020, IFIP International Federation for Information Processing.","agroclimatic modeling, big data, Crop growth modelling, data science, virtual research environments",0,0,1,1
10.1007/978-3-030-39815-6_8,AGINFRA PLUS: Running Crop Simulations on the D4Science Distributed e-Infrastructure,International Symposium on Environmental Software Systems,2020,Conference Paper,"Virtual Research Environments (VREs) bridge the gap between the compute and storage infrastructure becoming available as the ‘cloud’, and the needs of researchers for tools supporting open science and analytics on ever larger datasets. In the AGINFRA PLUS project such a VRE, based on the D4Science platform, was examined to improve and test its capabilities for running large numbers of crop simulations at field level, based on the WOFOST-WISS model and Dutch input datasets from the AgroDataCube. Using the gCube DataMiner component of the VRE, and based on the Web Processing Service standard, a system has been implemented that can run such workloads successfully on an available cluster, and with good performance, providing summarized results to agronomists for further analysis. The methods used and the resulting implementation are briefly described in this paper. Overall the approach seems viable and opening the door to many follow-up implementation opportunities and further research. Some of them are indicated in more detail in the conclusions. © 2020, IFIP International Federation for Information Processing.","Crop simulation model, distributed computing, e-infrastructures, virtual research environments, WOFOST",0,0,1,1
