doi,title,venue,publication_year,content_type,abstract,keywords,science gateway | scientific gateway,virtual laboratory | Vlab,virtual research environment,more than one
10.1088/1755-1315/96/1/012012,Architecture of a spatial data service system for statistical analysis and visualization of regional climate changes,IOP Conference Series: Earth and Environmental Science,2017,Conference Paper,"The use of large geospatial datasets in climate change studies requires the development of a set of Spatial Data Infrastructure (SDI) elements, including geoprocessing and cartographical visualization web services. This paper presents the architecture of a geospatial OGC web service system as an integral part of a virtual research environment (VRE) general architecture for statistical processing and visualization of meteorological and climatic data. The architecture is a set of interconnected standalone SDI nodes with corresponding data storage systems. Each node runs a specialized software, such as a geoportal, cartographical web services (WMS/WFS), a metadata catalog, and a MySQL database of technical metadata describing geospatial datasets available for the node. It also contains geospatial data processing services (WPS) based on a modular computing backend realizing statistical processing functionality and, thus, providing analysis of large datasets with the results of visualization and export into files of standard formats (XML, binary, etc.). Some cartographical web services have been developed in a system's prototype to provide capabilities to work with raster and vector geospatial data based on OGC web services. The distributed architecture presented allows easy addition of new nodes, computing and data storage systems, and provides a solid computational infrastructure for regional climate change studies based on modern Web and GIS technologies. © Published under licence by IOP Publishing Ltd.","Geography, XML, computer.internet_protocol, computers, metadata, Geoportal, Node (computer science), Web service, computer.software_genre, data science, Spatial data infrastructure, Geospatial analysis, databases, visualization",0,0,1,1
10.1093/bioinformatics/btu813,Workflow4Metabolomics: A collaborative research infrastructure for computational metabolomics,Bioinformatics,2015,Article,"The complex, rapidly evolving field of computational metabolomics calls for collaborative infrastructures where the large volume of new algorithms for data pre-processing, statistical analysis and annotation can be readily integrated whatever the language, evaluated on reference datasets and chained to build ad hoc workflows for users. We have developed Workflow4Metabolomics (W4M), the first fully open-source and collaborative online platform for computational metabolomics. W4M is a virtual research environment built upon the Galaxy web-based platform technology. It enables ergonomic integration, exchange and running of individual modules and workflows. Alternatively, the whole W4M framework and computational tools can be downloaded as a virtual machine for local installation. © 2014 The Author. Published by Oxford University Press.","annotation, collaborative online platform, bioinformatics, statistics, data analysis, metabolomics, data processing, [SDV.AEN]Life Sciences [q-bio]/Food and Nutrition, [INFO.INFO-IR]Computer Science [cs]/Information Retrieval [cs.IR], Applications Notes, Gene Expression, IDENTIFICATION, MASS-SPECTROMETRY DATA, web server, software, [INFO.INFO-BI]Computer Science [cs]/Bioinformatics [q-bio.QM], [INFO.INFO-DB]Computer Science [cs]/Databases [cs.DB], [SDV.BIBS]Life Sciences [q-bio]/Quantitative Methods [q-bio.QM], [SDV.BBM.GTP]Life Sciences [q-bio]/Biochemistry, Molecular Biology/Genomics [q-bio.GN], Computational Mathematics, Computational Theory and Mathematics, computer science applications, Molecular Biology, Biochemistry, Statistics and Probability, [ SDV.AEN ] Life Sciences [q-bio]/Food and Nutrition, [ INFO.INFO-IR ] Computer Science [cs]/Information Retrieval [cs.IR], Alimentation et Nutrition, Food and Nutrition, analyse métabolomique, plateforme collaborative, analyse statistique, expertise collective, computer science, Data pre-processing, World Wide Web, virtual machine, computer.software_genre, computers, Field (computer science), Identification (information), metabolomics, Software engineering, business.industry, business",0,0,1,1
10.1093/bioinformatics/btz160,Interoperable and scalable data analysis with microservices: Applications in metabolomics,Bioinformatics,2019,Article,"Motivation: Developing a robust and performant data analysis workflow that integrates all necessary components whilst still being able to scale over multiple compute nodes is a challenging task. We introduce a generic method based on the microservice architecture, where software tools are encapsulated as Docker containers that can be connected into scientific workflows and executed using the Kubernetes container orchestrator. Results: We developed a Virtual Research Environment (VRE) which facilitates rapid integration of new tools and developing scalable and interoperable workflows for performing metabolomics data analysis. The environment can be launched on-demand on cloud resources and desktop computers. IT-expertise requirements on the user side are kept to a minimum, and workflows can be re-used effortlessly by any novice user. We validate our method in the field of metabolomics on two mass spectrometry, one nuclear magnetic resonance spectroscopy and one fluxomics study. We showed that the method scales dynamically with increasing availability of computational resources. We demonstrated that the method facilitates interoperability using integration of the major software suites resulting in a turn-key workflow encompassing all steps for massspectrometry- based metabolomics including preprocessing, statistics and identification. Microservices is a generic methodology that can serve any scientific discipline and opens up for new types of large-scale integrative science. Availability and implementation: The PhenoMeNal consortium maintains a web portal (https://por tal.phenomenal-h2020.eu) providing a GUI for launching the Virtual Research Environment. The GitHub repository. © 2019 The Author(s). Published by Oxford University Press. All rights reserved.","bioinformatics, e-infrastructures, microservices, metabolomics, kubernetes, Docker, containers, Bioinformatics (Computational Biology), Bioinformatik (beräkningsbiologi), Computational Mathematics, Computational Theory and Mathematics, computer science applications, Molecular Biology, Biochemistry, Statistics and Probability, Espectrometria de masses, Interoperabilitat en xarxes d'ordinadors, Programari, Mass spectrometry, Internetworking (Telecommunication), Computer software, Original Papers, Systems Biology, Container (abstract data type), interoperability, workflows, Scalability, distributed computing, software, business.industry, business, Field (computer science), computer science, microservices, Source code, media_common.quotation_subject, media_common, Software engineering",0,0,1,1
10.1093/database/bav054,BioAcoustica: A free and open repository and analysis platform for bioacoustics,Database,2015,Article,"We describe an online open repository and analysis platform, BioAcoustica (http://bio. acousti.ca), for recordings of wildlife sounds. Recordings can be annotated using a crowdsourced approach, allowing voice introductions and sections with extraneous noise to be removed from analyses. This system is based on the Scratchpads virtual research environment, the BioVeL portal and the Taverna workflow management tool, which allows for analysis of recordings using a grid computing service. At present the analyses include spectrograms, oscillograms and dominant frequency analysis. Further analyses can be integrated to meet the needs of specific researchers or projects. Researchers can upload and annotate their recordings to supplement traditional publication. © The Author(s) 2015. Published by Oxford University Press.","Original Article, General Agricultural and Biological Sciences, General Biochemistry, Genetics and Molecular Biology, information systems, Bioacoustics, Noise (video), workflows, computer science, Spectrogram, Information retrieval, grid computing, computer.software_genre, computers, Service (systems architecture), World Wide Web, Upload, virtual research environments",0,0,1,1
10.1093/llc/fqs067,"The text-image-link-editor: A tool for linking facsimiles and transcriptions, and image annotations",Literary and Linguistic Computing,2013,Article,"TextGrid's Text-Image-Link-Editor is used to link segments of text with sections on the corresponding image. A typical application is the linking of scans of facsimiles with their transcriptions, though these texts can also be created during the linking process, which allows also for image annotations. The information on the linking between manuscript fragments and the corresponding transcription is itself stored in TEI P5. TextGrid is a virtual research environment for the humanities disciplines dealing with texts in a wide sense (philologies, epigraphy, linguistics, musicology, art history, etc.). The joint research project TextGrid is part of the D-Grid initiative and is funded by the German Federal Ministry of Education and Research (BMBF) for the period starting from 1 June 2009 to 31 May 2012 (reference number: 01UG0901A). TextGrid consists of two principal building blocks, the grid-based back-end TextGridRep that hosts both infrastructure services and the repository layer for access to research data and long-term archiving, and the user-facing TextGrid Laboratory (TextGridLab). The TextGridLab, a single point of entry to the virtual research environment, provides integrated access to both new and existing tools and services via user-friendly software based on the eclipse framework [TG]. TBLE is a key component of the TextGridLab that has been under continuous development since 2008 and is by now in practical use. © The Author 2013. Published by Oxford University Press on behalf of ALLC. All rights reserved.","language and linguistics, language and linguistics, information systems, Image (mathematics), Natural language processing, computer.software_genre, computers, artificial intelligence, business.industry, business, speech recognition, computer science, Link (knot theory)",0,0,1,1
10.1093/LLC/FQZ032,Toward a virtual research environment for the spatial humanities: Heimap,Digital Scholarship in the Humanities,2020,Article,"This article describes the context and design of heiMAP, a virtual research environment (VRE) currently under development at Heidelberg University. heiMAP is aimed at users from a wide spectrum of disciplines within the Humanities, allowing them to collaborate and share data using space as their common frame of reference by way of a collaborative web platform. We first set out the challenges that spatial research in the Humanities poses for such a working platform, including but not limited to reflecting the often heterogeneous and imperfect nature of Humanities data in a Geographic Information System (GIS). Next, we give an overview of some existing VREs and detail where heiMAP fits into this context and show what makes it a worthwhile addition to the existing research landscape. Finally, we revisit the initially outlined challenges and showcase heiMAP’s approaches to address them. © The Author(s) 2019. Published by Oxford University Press on behalf of EADH. All rights reserved.","Physical, chemical, mathematical & earth Sciences, Earth sciences & physical geography, Arts & humanities, Archaeology, engineering, computing & technology, computer science applications, language and linguistics, language and linguistics, information systems, Sociology, virtual research environments, World Wide Web",0,0,1,1
10.1093/nar/gkz759,Nucleosome Dynamics: a new tool for the dynamic analysis of nucleosome positioning,Nucleic acids research,2019,Article,"We present Nucleosome Dynamics, a suite of programs integrated into a virtual research environment and created to define nucleosome architecture and dynamics from noisy experimental data. The package allows both the definition of nucleosome architectures and the detection of changes in nucleosomal organization due to changes in cellular conditions. Results are displayed in the context of genomic information thanks to different visualizers and browsers, allowing the user a holistic, multidimensional view of the genome/transcriptome. The package shows good performance for both locating equilibrium nucleosome architecture and nucleosome dynamics and provides abundant useful information in several test cases, where experimental data on nucleosome position (and for some cases expression level) have been collected for cells under different external conditions (cell cycle phase, yeast metabolic cycle progression, changes in nutrients or difference in MNase digestion level). Nucleosome Dynamics is a free software and is provided under several distribution models. © The Author(s) 2019. Published by Oxford University Press on behalf of Nucleic Acids Research.","computational methods, Chromatin and Epigenetics, Genomics",0,0,1,1
10.1098/rsta.2010.0167,Deploying general-purpose virtual research environments for humanities research,"Philosophical Transactions of the Royal Society A: Mathematical, Physical and Engineering Sciences",2010,Article,"Several virtual research environments (VREs) have been developed to address specific tasks or application domains. Building on the experiences and use cases coming out of these projects, this paper addresses the creation of more general-purpose VREs for the humanities, which move beyond specific, focused tasks, and instead provide services and environments that support more general-purpose humanities research activities. Specifically, we are investigating use cases related to the organization and integration of the dispersed and heterogeneous information on which such research is based. These use cases are highly interactive, interpretative and researcher centric, addressing topics such as annotation environments and support for 'active-reading' processes and scholarly dialogues. We present the background to our work and the technical approach taken, and report the results obtained so far. This journal is © 2010 The Royal Society.","Digital archives, gCube, humanities, virtual research environments",0,0,1,1
10.1098/rsta.2012.0069,Secure data sharing across portals: Experiences from OneVRE,"Philosophical Transactions of the Royal Society A: Mathematical, Physical and Engineering Sciences",2013,Article,"Research and higher education are facing an on-going transformation of practice resulting in the need for effective collaboration and sharing of resources within and across disciplinary and geographical boundaries. Portal technologies and portal-based virtual research and learning environments (VREs and VLEs) already have become standard infrastructures within a large number of research communities and institutions. From 2004, a series of research and development projects began to ask the question whether an open source videoconferencing and collaboration system could be used as a complete, or as a part of, VRE. This study presents the evolution of these projects and at the same time, describes the definition of a VRE and their future possible integration. The OneVRE portlet integration project attempted to create missing components, including adding secure and universal identity management. This moves the idea of shared data to a different level by creating a new administrative domain that is outside the control of a single local institution portal and resolves certain administrative virtual organizations problems. We explain some of the hurdles that still need to be overcome to make this venture truly successful, when a complete toolkit can be designed for the researcher of the future. © 2012 The Author(s) Published by the Royal Society. All rights reserved.","Access Grid, e-science, portals, Shibboleth, virtual research environments",0,0,1,1
10.1108/02640471211204114,OJAX++ : Demonstrating the next generation of virtual research environments,Electronic Library,2012,Article,"Purpose - This paper aims to introduce the OJAX++ virtual research environment (VRE) and illustrate how it can enable researchers to organise and collaborate on their research in one place while using their own choice of popular web-based applications. Design/methodology/approach - Recent state-of-the-art reports have highlighted trends in best practice VRE design: the move towards lightweight, modular, Web 2.0 VRE frameworks, and the importance of interoperability and integration of third party applications in such frameworks. Findings - OJAX++ is a practical demonstration of these trends. Practical implications - The OJAX++ VRE is freely available under an open source licence. Social implications - The aim of VREs is to facilitate the research process and the OJAX++ VRE illustrates an implementation of this goal. Originality/value - The OJAX++ VRE demonstrates best practice in VRE design, as highlighted in recent state-of-the-art reports. © 2012 Emerald Group Publishing Limited.","e-research, interoperability, OJAX++, Open systems, research, virtual research environments, virtual research environments",0,0,1,1
10.1108/AJIM-02-2013-0009,The potential use of online tools for scientific collaboration by biology researchers,Aslib Proceedings: New Information Perspectives,2014,Article,"Purpose: The purpose of this paper is to discover the research practices of biology researchers and to assess the suitability of the OJAX++ Virtual Research Environment (VRE) for these researchers. Design/methodology/approach: Usability testing was used to evaluate the usability of OJAX++ in relation to biology researchers. Interviews with biology researchers in a large Irish university were conducted to investigate their research information behaviour, to establish user requirements in their discipline and to evaluate the feasibility of using OJAX++ in their research. Findings: The results show that biology researchers used online tools extensively in their research but do not use social networking tools. E-mail and phone conversations are the preferred methods of collaborating with colleagues. The biology researchers found that OJAX++ was easy to use, intuitive and professionally presented but in its present format, OJAX++ does not fit in with current research practices as they do not use Web 2.0 tools that facilitate tagging. A list of requirements of a VRE for biology researchers is presented. Originality/value: The findings of the study will assist developers of VREs and other web tools to better understand how researchers, in particular biologists, collaborate during the research process and what they require from online research tools. This study gives an important insight into the information behaviour of life science researchers. © Emerald Group Publishing Limited.","Information behaviour, Online research, Scientific collaboration, Usability testing, virtual research environments, web2.0",0,0,1,1
10.1108/LM-02-2020-0037,"A conceptual virtual research environment model for the management of research data, a South African perspective",Library Management,2020,Article,"Purpose: The purpose of this article is to give an overview of the development of a Virtual Research Environment (VRE) conceptual model for the management of research data at a South African university. Design/methodology/approach: The research design of this article consists of empirical and non-empirical research. The non-empirical part consists of a critical literature review to synthesise the strengths, weaknesses (limitations) and omissions of identified VRE models as found in literature to develop a conceptual VRE model. As part of the critical literature review concepts were clarified and possible applications of VREs in research lifecycles and research data lifecycles were explored. The empirical part focused on the practical application of this model. This part of the article follows an interpretivist paradigm, and a qualitative research approach, using case studies as inquiry method. Case studies with a positivist perspective were selected through purposive sampling, and inferences were drawn from the sample to design and test a conceptual VRE model, and to investigate the management of research data through a VRE. Investigation was done through a process of participatory action research (PAR) and included semi-structured interviews and participant observation data collection techniques. Evaluation of findings was done through formative and summative evaluation. Findings: The article presents a VRE conceptual model, with identified generic component layers and components that could potentially be applied and used in different research settings/disciplines. The article also reveals the role that VREs play in the successful management of research data throughout the research lifecycle. Guidelines for setting up a conceptual VRE model are offered. Practical implications: This article assisted in clarifying and validating the various components of a conceptual VRE model that could be used in different research settings and disciplines for research data management. Originality/value: This article confirms/validates generic layers and components that would be needed in a VRE by synthesising these in a conceptual model in the context of a research lifecycle and presents guidelines for setting up a conceptual VRE model. © 2020, Emerald Publishing Limited.","components, Conceptual model, Research data management, South Africa, virtual research environments, virtual research environments",0,0,1,1
10.1109/DEST.2013.6611330,CENDARI: Establishing a digital ecosystem for historical research,IEEE International Conference on Digital Ecosystems and Technologies,2013,Conference Paper,"The CENDARI (Collaborative European Digital Archive Infrastructure) project, which aims to create a research infrastructure for World War I and medieval history, is examined as a example digital ecosystem. The diverse information requirements of these two communities are met by a strategy which combines newly devised approaches to metadata and tools for data integration and ontology development. The ways in which this strategy produces an environment which conforms to the notion of a digital ecosystem is also examined. © 2013 IEEE.","digital ecosystems, intermediary metadata schemas, metadata, virtual research environments",0,0,1,1
10.1109/DEST.2013.6611331,TEXTvre: Textual scholarship and the institutional ecosystem,IEEE International Conference on Digital Ecosystems and Technologies,2013,Conference Paper,"Digital humanists have for many years been producing online editions of texts based on TEI XML, a widely-adopted standard for marking up textual resources with semantic content. More recently, the e-infrastructure community has been investigating virtual research environments (VREs), which integrate information resources and tools for supporting research activities. These two fields of activity came together in TextGrid, a collaborative VRE for textual scholarship. This paper describes and evaluates an attempt to build on TextGrid by developing an institutionally-focused ecosystem that includes texts, tools, services, infrastructural resources, and, of course, the scholars themselves. © 2013 IEEE.","collaboration, digital humanities, e-research, GATE, repositories, TextGrid, textual editing, textual scholarship, TEXTyre, virtual research environments",0,0,1,1
10.1109/eScience.2010.37,Towards a virtual research environment for language and literature researchers,International Conference on e-Science,2010,Conference Paper,"Language and literature researchers use variety of data resources in order to conduct their day-to-day research. Such resources include dictionaries, thesauri, corpora, images, audio and video collections. These resources are typically distributed, and comprise non-interoperable repositories of data that are often license protected. In this context, researchers conduct their research through direct access to individual resources. This form of research is non-scalable, time consuming and often frustrating to the researchers. The JISC funded project Enhancing Repositories for Language and Literature Researchers (ENROLLER, http://www.gla.ac.uk/enroller/) aims to address by provision of an interactive, research infrastructure providing seamless access to major language and literature repositories. This paper describes this infrastructure and the services that have been developed to overcome the issues in access and use of digital resources in humanities. In particular, we describe how high performance computing facilities including the UK e-Science National Grid Service (NGS, http://www.ngs.ac.uk) have been exploited to support advanced, bulk search capabilities, implemented using Google's MapReduce algorithm. We also describe our experiences in the use of the resource brokering Workload Management System (WMS) and the Virtual Organization Membership Service (VOMS) solutions in this space. Finally we outline the experiences from the arts and humanities community on the usage of this infrastructure. © 2010 IEEE.","grid, HPC, humanities, Language and literature, MapReduce",0,0,1,1
