doi,title,venue,publication_year,content_type,abstract,keywords,science gateway | scientific gateway,virtual laboratory | Vlab,virtual research environment,more than one
10.1007/978-3-642-24469-8_12,An approach to virtual research environment user interfaces dynamic construction,Lecture Notes in Computer Science ,2011,Conference Paper,"Virtual Research Environments are internet-based working environments tailored to serve needs of diverse and evolving user communities. These environments are oriented to promote new ways of dealing with modern research tasks. Their realization requires user interfaces that are dynamically built to provide their clients with organised views on the data and services aggregated to meet specific community needs. This paper presents an approach to the problem of Virtual Research Environment user interfaces dynamic construction. This approach is characterized by user interfaces built through a component-oriented strategy and an heuristic for user interface constituents arrangement on the screen. The implementation and exploitation of the proposed approach in the context of the D4Science-II, EU funded project is discussed as well as future plans are presented. © 2011 Springer-Verlag.","virtual research environments, User interfaces. Dynamic construction, D4Science-II Project, Heuristic, Realization (linguistics), computer science, user interfaces, User modeling, The Internet, business.industry, business, User interface design, human-computer interaction, Context (language use), virtual research environments",0,0,1,1
10.1007/978-3-642-34222-6_15,DEMO: OurSpaces - A provenance enabled virtual research environment,Lecture Notes in Computer Science ,2012,Conference Paper,"In this demo we present ourSpaces, a Virtual Research Environment designed to support inter-disciplinary research teams. This system has been developed to facilitate collaboration and interaction between researchers by enabling users to create, visualise and manage the provenance of research artefacts and processes. © 2012 Springer-Verlag.","e-research, provenance, virtual research environments",0,0,1,1
10.1007/978-3-642-35173-0_4,OurSpaces - Design and deployment of a semantic virtual research environment,Lecture Notes in Computer Science ,2012,Conference Paper,"In this paper we discuss our experience with the design, development and deployment of the ourSpaces Virtual Research Environment. ourSpaces makes use of Semantic Web technologies to create a platform to support multi-disciplinary research groups. This paper introduces the main semantic components of the system: a framework to capture the provenance of the research process, a collection of services to create and visualise metadata and a policy reasoning service. We also describe different approaches to support interaction between users and metadata within the VRE. We discuss the lessons learnt during the deployment process with three case study groups. Finally, we present our conclusions and future directions for exploration in terms of developing ourSpaces further. © 2012 Springer-Verlag Berlin Heidelberg.","NLG, Policies, provenance, virtual research environments",0,0,1,1
10.1007/978-3-642-39640-3_27,Development of an endocrine genomics virtual research environment for australia: Building on success,Lecture Notes in Computer Science ,2013,Conference Paper,"The $47m Australian National eResearch Collaboration Tools and Resources (NeCTAR - www.nectar.org.au) project has recently funded an initiative to establish an Australia-wide endocrine genomics virtual laboratory (endoVL - www.endovl.org.au) covering a range of disorders including type-1, type-2 diabetes, rare diabetes-related disorders, obesity/thyroid disorders, neuroendocrine/adrenal tumours, bone disorders and disorders of sex development. This virtual laboratory will establish a range of targeted databases, clinical registries and support a range of genetically targeted clinical trials leveraging a body of international projects and experiences garnered over many years through a range of EU and MRC funded initiatives. This paper focuses on the plans for endoVL and especially, the systems it leverages in supporting large-scale clinical, collaborative environments. © 2013 Springer-Verlag Berlin Heidelberg.","endocrine disorders, security, virtual research environments",0,1,1,2
10.1007/978-94-007-5125-5_4,Application of the research environment e-kinematix in mechanism development,Mechanisms and Machine Science,2012,Conference Paper,"Research and development (R&D) projects require a structured approach for the creation of sound results. Particularly, complex problems benefit from information and data management and clear organizational structures to increase process efficiency. With the creation of a virtual research environment to organize, enhance, link and publish data, the cooperation between project partners, documentation and re-use of research and development results are supported. The aim of the e-Kinematix Project has been the creation of such a virtual research environment for the research and development of mechanisms. © Springer Science+Business Media Dordrecht 2012.","Interactive design, R&D process, Web based support tools",0,0,1,1
10.1007/s00799-014-0127-x,Evaluating a digital humanities research environment: the CULTURA approach,International Journal on Digital Libraries,2014,Article,"Digital humanities initiatives play an important role in making cultural heritage collections accessible to the global community of researchers and general public for the first time. Further work is needed to provide useful and usable tools to support users in working with those digital contents in virtual environments. The CULTURA project has developed a corpus agnostic research environment integrating innovative services that guide, assist and empower a broad spectrum of users in their interaction with cultural artefacts. This article presents (1) the CULTURA system and services and the two collections that have been used for testing and deploying the digital humanities research environment, and (2) an evaluation methodology and formative evaluation study with apprentice researchers. An evaluation model was developed which has served as a common ground for systematic evaluations of the CULTURA environment with user communities around the two test bed collections. The evaluation method has proven to be suitable for accommodating different evaluation strategies and allows meaningful consolidation of evaluation results. The evaluation outcomes indicate a positive perception of CULTURA. A range of useful suggestions for future improvement has been collected and fed back into the development of the next release of the research environment. © 2014, Springer-Verlag Berlin Heidelberg.","Cultural heritage, digital humanities, evaluation, virtual research environments",0,0,1,1
10.1007/s10606-011-9137-z,Agile project management: A case study of a Virtual Research Environment development project,Computer Supported Cooperative Work,2011,Article,"In this paper we use a case study of a project to create a Web 2.0-based, Virtual Research Environment (VRE) for researchers to share digital resources in order to reflect on the principles and practices for embedding eResearch applications within user communities. In particular, we focus on the software development methodologies and project management techniques adopted by the project team in order to ensure that the project remained responsive to changing user requirements without compromising their capacity to keep the project 'on track', i.e. meeting the goals declared in the project proposal within budget and on time. Drawing on ethnographic fieldwork, we describe how the project team, whose members are distributed across multiple sites (and often mobile), exploit a repertoire of coordination mechanisms, communication modes and tools, artefacts and structuring devices as they seek to establish the orderly running of the project while following an agile, user-centred development approach. © Springer 2011.","Agile software project management, e-research, User engagement, virtual research environments, web2.0",0,0,1,1
10.1007/s10723-016-9375-x,Beyond a Disease Registry: An Integrated Virtual Environment for Adrenal Cancer Research,Journal of Grid Computing,2016,Article,"Many biomedical research collaborations are focused on the establishment of web-based databases that capture phenotypic and in some cases genotypic information, targeted to specific diseases – so called disease registries. Such resources are often used for clinical matchmaking and allow information on patients and patient disorders to be shared by clinicians with wider biomedical research communities outside of a given hospital setting, and potentially with patients and/or patient advisory groups. Whilst addressing aspects of clinical collaborations through making targeted biomedical data accessible - such registries are really only a starting point for what can be achieved to support research collaborations. In particular, registries should ideally be augmented with a portfolio of additional service offerings that facilitate secure research collaborations: bio-banking and bio-sample data tracking capabilities; support for feasibility analysis on clinical trials and studies; offer seamless data transfer to/from clinical trials; provide search and analytical capabilities in a user-driven research environment. Such a feature rich, Internet-based virtual research environment (VRE) has been established as part of the European Union funded ENS@T-CANCER (http://www.ensat-canser.eu) project that has a particular focus on supporting research into four primary types of adrenal tumors. This paper provides an overview of the ENS@T-CANCER VRE, outlining its core capabilities and how it has galvanized previously and largely fragmented, country-specific database and registry efforts. To illustrate the utility of the ENS@T-CANCER VRE for clinical trials we focus on the full 4-phase, international, multi-centre Prospective Monoamine Tumor (PMT) clinical trial and its utilisation of capabilities provided by the VRE. © 2016, Springer Science+Business Media Dordrecht.","Adrenal cancer, Disease registry, virtual research environments",0,0,1,1
10.1007/s10980-014-0122-z,ESLab application to a boreal watershed in southern Finland: preparing for a virtual research environment of ecosystem services,Landscape Ecology,2015,Article,"We report on preparatory work to develop a virtual laboratory for ecosystem services, ESLab, and demonstrate its pilot application in southern Finland. The themes included in the pilot are related to biodiversity conservation, climate mitigation and eutrophication mitigation. ESLab is a research environment for ecosystem services (ES), which considers ES indicators at different landscape scales: habitats, catchments and municipalities and shares the results by a service that utilizes machine readable interfaces. The study area of the pilot application is situated in the boreal region of southern Finland and covers 14 municipalities and ten catchments including forested, agricultural and nature conservation areas. We present case studies including: present carbon budgets of natural ecosystems; future carbon budgets with and without the removal of harvest residues for bioenergy production; and total phosphorus and nitrogen future loads under climate and agricultural yield and price scenarios. The ESLab allows researchers to present and share the results as visual maps, statistics and graphs. Our further aim is to provide a toolbox of easily accessible virtual services for ES researchers, to illustrate the comprehensive societal consequences of multiple decisions (e.g. concerning land use, fertilisation or harvesting) in a changing environment (climate, deposition). © 2014, Springer Science+Business Media Dordrecht.","Agriculture, biodiversity, Carbon budget, Eutrophication, Forestry, GIS",0,1,1,2
10.1007/s11182-016-0800-1,From Atmospheric Gas Spectroscopy to Climatological Problems,Russian Physics Journal,2016,Article,"Readers are offered a brief review of sample results obtained from spectroscopic investigations begun in Laboratory of Spectroscopy of V. D. Kuznetsov Siberian Physical-Technical Institute at Tomsk State University as early as the 1930s. Specifically, we present findings of theoretical studies of relevance to a description of the light absorption in atmospheric windows and hence to solutions of global climate problems associated with the processes involving frequencies lying far from line centers. In the course of years, a large amount of spectroscopic data has been accumulated, which led to rapid development of information-computational systems to be discussed in the present work. Not only are the considered systems capable of making computations according to preset algorithms, but they can also provide answers relating to the completeness and comparison of the data collected in the system, taking into account the structure of the subject domain in question. A prototype of a computational-information infrastructure (virtual research environment) supporting climate studies is proposed. © 2016, Springer Science+Business Media New York.","atmospheric gas spectroscopy, information-computational systems, radiation balance, spectral line wings, virtual research environments",0,0,1,1
10.1007/s12145-017-0305-7,The MED-SUV virtual research environment for enabling the GEO Geohazard supersites in Italy,Earth Science Informatics,2017,Article,"This paper presents the Virtual Research Environment (VRE) enabling two European GEO Geohazard Supersites in Italy. According to GEO (Group on Earth Observation) vision, Geohazard Supersites provide access to spaceborne and in-situ geophysical data and models for selected sites prone to natural hazards –noticeably, earthquakes and volcano eruptions. The VRE was implemented in the framework of the Mediterranean Supersite Volcanoes (MED-SUV) project, funded by the European Commission. MED-SUV realized one of the European supersite demonstrators covering the two Permanent Supersites selected in Italy: Mt. Etna and Campi Flegrei/Vesuvius. The MED-SUV VRE provides advanced services for heterogeneous data and information management and sharing. MED-SUV started identifying the main supersite requirements including: the interoperability with existing data/information supply systems, the support of policy-based access control, the access to processing capabilities provided by external platforms, the management resources for publishing and sharing new products, the integration with significant global systems such as GEOSS and EPOS. MED-SUV adopted a System of Systems (SoS) approach to address interoperability with the identified heterogeneous systems supplying data and information. The SoS approach is based on a brokering architecture, where a specialized component (i.e the MED-SUV Broker: MSB) connects the existing and next-coming data sources leaving them autonomous. MSB carries out all the necessary mediation and harmonization tasks exposing standard interfaces enabling the interconnection with external systems like GEOSS and EPOS. In addition, MSB is accessible via a JavaScript library implementing Web APIs to facilitate the development of Web and mobile applications. © 2017, Springer-Verlag Berlin Heidelberg.","Data systems, Distributed information systems, GEOSS, middleware, System of systems, virtual research environments",0,0,1,1
10.1016/j.cmpb.2015.11.001,Resolving complex research data management issues in biomedical laboratories: Qualitative study of an industry-academia collaboration,Computer Methods and Programs in Biomedicine,2016,Article,"This paper describes a distributed collaborative effort between industry and academia to systematize data management in an academic biomedical laboratory. Heterogeneous and voluminous nature of research data created in biomedical laboratories make information management difficult and research unproductive. One such collaborative effort was evaluated over a period of four years using data collection methods including ethnographic observations, semi-structured interviews, web-based surveys, progress reports, conference call summaries, and face-to-face group discussions. Data were analyzed using qualitative methods of data analysis to (1) characterize specific problems faced by biomedical researchers with traditional information management practices, (2) identify intervention areas to introduce a new research information management system called Labmatrix, and finally to (3) evaluate and delineate important general collaboration (intervention) characteristics that can optimize outcomes of an implementation process in biomedical laboratories. Results emphasize the importance of end user perseverance, human-centric interoperability evaluation, and demonstration of return on investment of effort and time of laboratory members and industry personnel for success of implementation process. In addition, there is an intrinsic learning component associated with the implementation process of an information management system. Technology transfer experience in a complex environment such as the biomedical laboratory can be eased with use of information systems that support human and cognitive interoperability. Such informatics features can also contribute to successful collaboration and hopefully to scientific productivity. © 2015 Elsevier Ireland Ltd.","Biomedical laboratory, Cognition, Industry-academia collaboration, Informatics implementation, information management, virtual research environments",0,0,1,1
10.1016/j.foodcont.2020.107623,Global Food-source Identifier (GFI): Collaborative virtual research environment and shared data catalogue for the foodborne outbreak investigation international community,Food Control,2021,Article,"The source of a foodborne disease outbreak (FBO) is often difficult to identify, especially in the early phase where interventions would be most efficient. In addition, data on FBOs are mostly scattered in different formats either in national databases and reports or within pathogen-specific or regional reporting networks, both of which are often only accessible to a selected number of individuals. Here, we developed an international, open, shared and searchable data catalogue of past FBOs – the Global Food-source Identifier (GFI). GFI was developed with two objectives: a) to create a collaborative online community of FBO investigators, encouraging the international sharing of data in a harmonized, detailed and comparable manner and b) to support foodborne outbreak investigation worldwide by providing access to detailed records of past outbreaks, which can convey valuable insight into potential ‘risk foods’ of a detected pathogen. GFI is hosted within a Virtual Research Environment (VRE), which offers additional features to facilitate the collaboration between the outbreak investigators. These features allow document exchange, communication and data visualization and analysis between the VRE members. Based on scientific literature on foodborne outbreaks and discussions within a working group, we selected a total of 46 attributes characterising the outbreak records to be included in the catalogue, aggregated under the four overarching categories causative agent, epidata, food source and report details. Detailed descriptions of the attributes in the catalogue and instructions for harmonized data reporting are available on a wiki page in the VRE. At the time of writing and public launch of GFI, the data catalogue was populated with records of 102 FBOs occurred in Denmark over a period of 12 years (2005–2016) and covering the most frequent pathogens and a broad range of typing methods. The VRE features that enable data analysis, document sharing and communication between members were applied for the graphical representation of the records available in GFI, and for the sharing of results and script files within the VRE. The descriptive analysis included the relationship between the most frequent causative agents and outbreak food sources. Such results can support a risk-based food sampling strategy in the very beginning of a foodborne outbreak investigation. The Global Food-source Identifier is a data catalogue specifically designed to host an international collection of FBO records reported in a detailed and harmonized manner. It is implemented in a virtual research environment that offers key features to facilitate and enhance the global collaboration and data sharing among FBO investigators. Once in active use by the international food safety community, we envisage that GFI will contribute to the success of FBO investigations worldwide. © 2020 The Authors","data sharing, Food source, Foodborne outbreak investigation, Harmonization, Microbial typing, virtual research environments",0,0,1,1
10.1016/j.future.2011.07.004,Building an ecoinformatics platform to support climate change adaptation in Victoria,Future Generation Computer Systems,2013,Conference Paper,"Our research is focused on developing an ecoinformatics platform to support climate change adaptation in Victoria. A multi-disciplinary, cross-organisational approach was taken in developing a platform of collaboration to support the understanding of climate change impact and the formulation of adaptation strategies. The platform comprises a number of components including: (i) a metadata discovery tool to support modelling, (ii) a workflow framework for connecting climate change models, (iii) geographical visualisation tools for communicating landscape and farm impacts, (iv) a landscape object library for storing and sharing digital objects, (v) a landscape constructor tool to support participatory decision-making, and (vi) an online collaboration space for supporting multi-disciplinary research and cross-organisational collaboration. In this paper we present the platform as it has been developed to support collaborative research and to inform stakeholders of the likely impacts of climate change in southwest Victoria, Australia. We discuss some of the drivers for research in developing the ecoinformatics platform and its components. We conclude by identifying some future research directions in better connecting researchers and communicating scientific outcomes in the context of climate change impact and adaptation. © 2012 Elsevier B.V. All rights reserved.","climate change, e-science, Geographical visualisation, Models, virtual research environments, workflows",0,0,1,1
10.1016/j.future.2012.03.015,Towards a virtual research environment for language and literature researchers,Future Generation Computer Systems,2013,Conference Paper,"Language and literature researchers often use a variety of data resources in order to conduct their day-to-day research. Such resources include dictionaries, thesauri, corpora, images, audio and video collections. These resources are typically distributed, and comprise non-interoperable repositories of data that are often licence protected. In this context, researchers typically conduct their research through direct access to individual web-based resources. This form of research is non-scalable, time consuming and often frustrating to the researchers. The JISC funded project Enhancing Repositories for Language and Literature Researchers (ENROLLER, http://www.gla.ac.uk/ enroller/) aims to address this by provision of an interactive, research infrastructure providing seamless access to a range of major language and literature repositories. This paper describes this infrastructure and the services that have been developed to overcome the issues in access and use of digital resources in humanities. In particular, we describe how high performance computing facilities including the UK e-Science National Grid Service (NGS, http://www.ngs.ac.uk) have been exploited to support advanced, bulk search capabilities, implemented using Google's MapReduce algorithm. We also describe our experiences in the use of the resource brokering Workload Management System (WMS) and the Virtual Organization Membership Service (VOMS) solutions in this space. Finally we outline the experiences from the arts and humanities community on the usage of this infrastructure. © 2012 Elsevier B.V. All rights reserved.","ENROLLER, grid, HPC, humanities, Language and literature, MapReduce",0,0,1,1
