doi,title,venue,publication_year,content_type,abstract,keywords,science gateway | scientific gateway,virtual laboratory | Vlab,virtual research environment,more than one
10.1145/2753524.2753527,Science Gateway canvas: A business reference model for Science Gateways,Workshop on the Science of Cyberinfrastructure,2015,Conference Paper,"Science Gateways (SGs) have emerged as systems that facilitate access to cyberinfrastructures. There is a growing interest in the exploitation and development of SGs. However, it remains challenging to understand and design SG with the required properties because of the complex nature of SGs. Additionally, it is difficult to decide upon frameworks that can be used to build them. In this paper we propose the Science Gateway Canvas, a business reference model for SGs that embodies the common SG functions and their organization into groups and categories. We used the Science Gateway Canvas for a systematic analysis and comparison of the functions offered by a selection of available frameworks that are used to build SGs. This illustrated the applicability of the Science Gateway Canvas as a comprehensive and generic reference model for understanding SGs. The canvas can also be used for systematic analysis by scientists who are searching for an existing SG that supports their research goal or developers who want to determine the functional requirements for a new SG. Copyright © 2015 ACM.","Business reference model, Collaboratory, cyberinfrastructures, e-infrastructures, e-Research environment, e-science, problem solving environment , science gateways, Science Gateway Canvas (SGC), Science Gateway development, Science Gateway frameworks, Science Gateway technologies, science portal, virtual laboratory, virtual research environments",1,1,1,3
10.1145/2909132.2927471,Road mapping infrastructures for advanced visual interfaces supporting big data applications in virtual research environments,Workshop on Advanced Visual Interfaces,2016,Conference Paper,"Handling the complexity of relevant data requires new techniques about data access, visualization, perception, and interaction for innovative and successful strategies. In order to address human-computer interaction, cognitive efficiency, and interoperability problems, a generic information visualization, user empowerment, as well as service integration and mediation approach based on the existing state-of-the-art in the relevant areas of computer science has to be achieved. This workshop will address these issues with a special focus on supporting distributed Big Data analysis in Virtual Research Environments (VREs). In this way, the overall scope and goal of the workshop is to bring together researchers in these areas to achieve a road map, which can support the acceleration in research activities by means of transforming, enriching, and deploying advanced visual user interfaces for managing and using e-Science infrastructures. Advancements in this fields of research can i.e. support the, creation, configuration, management, and usage of distributed Big Data analysis in VREs. © 2016 Copyright held by the owner/author(s).","Advanced visual user interfaces, distributed big data analysis, Information visualization, User empowerment, virtual research environments",0,0,1,1
10.1145/3125433.3125457,SMW based VRE for addressing multi-layered data analysis - The use case of classroom interaction interpretation,International Symposium on Open Collaboration,2017,Conference Paper,"Virtual research environments (VREs) based on Semantic MediaWiki (SMW) provide researchers with more effective means of collaborative knowledge creation. The main challenge is capturing the multi-layered and iterative research process by participatory and evolutionary design using an agile framework development. The paper focuses on the development of a VRE to enhance scholarly research practices with the specific goal to enable dialogic transcript data analysis in Social Sciences and Humanities, using digital and semantic technologies. To offer a user-friendly framework with a low technological barrier, the authors used existing SMW extensions and developed a novel extension for multi-layered dialogic analysis by adopting the researcher's theoretical model of Objective Hermeneutic. As use case of addressing dialogic qualitative data analysis, the paper presents the VRE for classroom interaction which is based on two ontological models, the Objective Hermeneutic core ontology and the classroom interaction ontology, as a result of authors' work. © 2017 ACM.","Conversation Analysis, Dialogical Theories, humanities, Objective Hermeneutic, Open Collaboration Research, Qualitative Data Analysis, semantic MediaWiki, semantic web, Social Sciences, virtual research environments",0,0,1,1
10.1159/000313434,The European disorder of sex development registry: A virtual research environment,Sexual Development,2010,Article,"Disorders of sex development (DSD) are a rare group of conditions which require further research. Effective research into understanding the aetiology, as well as long-term outcome of these rare conditions, requires multicentre collaboration often across national boundaries. The EU-funded EuroDSD programme (www.eurodsd.eu) is one such collaboration involving clinical centres and clinical and genetic experts across Europe. At the heart of the EuroDSD collaboration is a European DSD registry and a targeted virtual research environment (VRE) that supports the sharing of DSD data. Security, ethics and information governance are cornerstones of this infrastructure. This paper describes the infrastructure that has been developed, the inherent challenges in security, availability and dependability that must be overcome for the enterprise to succeed and provides a sample of the data that are stored in the registry along with a summary analysis of the current data sets. Copyright © 2010 S. Karger AG, Basel.","databases, Intersex, networks",0,0,1,1
10.1186/1758-2946-3-45,Ami - The chemist's amanuensis,Journal of Cheminformatics,2011,Article,"The Ami project was a six month Rapid Innovation project sponsored by JISC to explore the Virtual Research Environment space. The project brainstormed with chemists and decided to investigate ways to facilitate monitoring and collection of experimental data. A frequently encountered use-case was identified of how the chemist reaches the end of an experiment, but finds an unexpected result. The ability to replay events can significantly help make sense of how things progressed. The project therefore concentrated on collecting a variety of dimensions of ancillary data - data that would not normally be collected due to practicality constraints. There were three main areas of investigation: 1) Development of a monitoring tool using infrared and ultrasonic sensors; 2) Time-lapse motion video capture (for example, videoing 5 seconds in every 60); and 3) Activity-driven video monitoring of the fume cupboard environs. The Ami client application was developed to control these separate logging functions. The application builds up a timeline of the events in the experiment and around the fume cupboard. The videos and data logs can then be reviewed after the experiment in order to help the chemist determine the exact timings and conditions used. The project experimented with ways in which a Microsoft Kinect could be used in a laboratory setting. Investigations suggest that it would not be an ideal device for controlling a mouse, but it shows promise for usages such as manipulating virtual molecules. © 2011 Brooks et al; licensee Chemistry Central Ltd.","speech recognition, Video Capture, Fume Cupboard, Speech Recognition Package, Java Medium Framework",0,0,1,1
10.12694/scpe.v19i2.1347,Climate applications in a virtual research environment platform,Concurrency and Computation: Practice and Experience,2018,Article,"Previous atmospheric composition studies were based on extensive computer simulations carried out with good resolution using up-to-date modelling tools and detailed and reliable input data. The oncoming climate changes will exert influence on the ecosystems, on the all branches of the international economy, and on the quality of life. Regional climate models (RCMs) are important instruments used for downscaling climate simulations from Global circulation models (GCMs). The air quality (AQ) impact on human health and quality of life is an issue of great social significance. Evaluating this impact will give scientifically robust basis for elaborating efficient short term measures and long term strategies for mitigation of the harmful effects of air pollution. The AQ impact is evaluated in the terms of Air Quality Indices (AQI). Some extensive numerical simulations of the atmospheric composition fields in Bulgaria and Sofia have been recently performed. A quite extensive data base was created from simulations which were used for different studies of the atmospheric composition, including the AQ climate. Main aims of the numerical experiment presented in this paper are: (1) Adaptation and tuning of the RegCM model for the Balkan Peninsula and Bulgaria and thus development of a methodology able to predict possible changes of the regional climate for different global climate change scenarios and their impact on spatial/temporal distribution of precipitation, hence the global water budgets, to changes of the characteristics and spatial/temporal distribution of extreme, unfavorable and catastrophic events (drought, storms, hail, floods, fires, sea waves, soil erosion, etc.). (2) Development of a methodology and performing reliable, comprehensive and detailed studies of the impact of lower atmosphere parameters and characteristics on the quality of life (QL) and health risks (HR) for the population. © 2018 SCPE.","Air Quality Indices, RegCM, Regional climate models, virtual research environments",0,0,1,1
10.12694/scpe.v19i2.1350,Solutions for Data Discovery Service in a Virtual Research Environment,Concurrency and Computation: Practice and Experience,2018,Article,"Scientific computing requires many and large volumes of complex structured data and metadata that are scattered across data centers. Researchers find it difficult to discover the specific data they need for their research. Traditional search engines, such as Google, are not effective in most of these cases. Moreover, some of the scientific data are confidential and are not publicly indexed. Therefore, it is necessary to develop a custom solution that satisfies the researchers' need for flexible search. This article introduces the Data Discovery Service designed to serve the Virtual Research Environment (VRE) during the VI-SEEM project. The solution is based on a specially configured and upgraded version of the CKAN platform. The main installation procedure is described, as well as the authors' contributions for the purpose of regularly harvesting data from different sources and updating the available content on which user queries are to be executed. © 2018 SCPE.","Data harvesting, Data service, Search engine, virtual research environments",0,0,1,1
10.12694/scpe.v19i2.1354,Improving service management for federated resources to support virtual research environments,Concurrency and Computation: Practice and Experience,2018,Article,"Virtual research environments provide an easy access to e-Infrastructures for researchers by creating an abstracted service-oriented layer on top of the available resources. Using the portal, researchers can focus on the research workflow and data analysis while being provided with a consolidated unified view of all tools necessary for their activities. The sustainable lifecycle of a virtual research environment can only be achieved if it is going to be used with high quality of experience by a large body of users. Aiming for this goal, in this paper we analyse the requirements and implementation of a cross-community virtual research environment that brings together researchers from three different domains. Promoting interdisciplinary research and cooperation, the federated virtual research environment is based on the service orientation paradigm, offering anything as a service solutions. Thus, the main pillar for a successful implementation of this solution is the careful design and management of the underlying elementary services and service compositions. The rest of the paper discusses the challenges of the service management implementation focusing on interoperability by design and service management standards. © 2018 SCPE.","e-infrastructures, Federation, Service management, virtual research environments",0,0,1,1
10.14434/sdh.v1i2.23330,"Virtual research environment for digital 3D reconstructions: Standards, thresholds, and prospects",Studies in Digital Heritage,2017,Article,"Since the 1990s, the application of digital 3D reconstruction and computer-based visualization of cultural heritage has increased. Virtual reconstruction and 3D visualization have revealed a new “glittering” research space for object-oriented disciplines such as archaeology, art history and architecture. Nevertheless, the scientists concerned with the new technology soon recognized the lack of documentation standards in the 3D projects, leading to the loss of information, findings and the fusion of knowledge behind the digital 3D representation. Based on the methodological fundamentals of digital 3D reconstruction, the potentials and challenges in the light of emerging Semantic Web and Web3D technologies is introduced here. The presentation describes a scientific methodology and a collaborative web-based research environment followed by crucial features for these kinds of projects. As the groundwork, a human- and machine-readable “language of objects” and the implementation of these semantic patterns for spatial research purposes on destroyed and/or never realized tangible cultural heritage will be discussed. Using examples from the practice, the presentation explains the requirements of the Semantic Web (Linked Data), the role of controlled vocabularies, the architecture of the VRE and the impact of a customized integration of interactive 3D models within WebGL technology. The presentation intends to showcase the state-of-the-art steps on the way to a digital research infrastructure. The focus lies on the introduction of scholarly approved and sustainable digital 3D reconstruction, compliant with recognized documentation standards and following the Linked Data requirements. © 2017 SDH Open Access Journal","3D modeling, Data modeling, Digital hypothetical 3D reconstruction, linked data, virtual research environments",0,0,1,1
10.1515/opth-2019-0001,The Impact of Digital Research: Thinking about the MARK16 Project,Open Theology,2019,Article,"This article presents the challenges of developing Humanities research in a digital environment in relation to a New Testament test-case: the MARK16 project. The first section argues that virtual research environments (VREs) have become an excellent milieu in which to develop a digitized research project based on collaborative work. The second section presents an overview of VREs and digital projects on the New Testament. The third section demonstrates the ways in which the MARK16 project participates in the development of VREs and fosters new modes of engaging material in digitized NT research. © 2019 Claire Clivaz, published by De Gruyter.","DARIAH, digital culture, digital humanities, digital practices, Gospel of Mark, history, humanities, New Testament, research, virtual research environments",0,0,1,1
10.1629/2048-7754.152,The research cycle and research data management (RDM): Innovating approaches at the University of Westminster,Insights: the UKSG Journal,2014,Article,"This article presents a case study based on experience of delivering a more joined-up approach to supporting institutional research activity and processes, research data management (RDM) and open access (OA). The result of this small study, undertaken at the University of Westminster in 2013, indicates that a more holistic approach should be adopted, embedding RDM more fully into the wider research management landscape and taking researchers' priorities into consideration. Rapid development of an innovative pilot system followed closely on from a positive engagement with researchers, and today a purpose-built, integrated and fully working set of tools are functioning within the virtual research environment (VRE). This provides a coherent 'thread' to support researchers, doctoral students and professional support staff throughout the research cycle. The article describes the work entailed in more detail, together with the impact achieved so far and what future work is planned.","Library and Information Sciences, lcsh:Bibliography. Library science. Information resources, lcsh:Z, Knowledge management, business.industry, business, Sociology, Pilot system, RDM, Engineering management, Professional support, virtual research environments, research data, Institutional research, Research management",0,0,1,1
10.18564/jasss.1835,Science as a social system and virtual research environment,Journal of Artificial Societies and Social Simulation,2011,Article,"The accumulation of gradual changes in scientific landscape and research practice due to the Internet has the potential to enhance the quality of both cognitive and social aspects of science and scientists. New types of research outputs, modes of scientific communication and new circulation mechanisms, as well as enhanced opportunities for scientific re-use and measuring research impact, in combination with new approaches to research assessment and evaluation are all having profound effects on the social system of science. To be sure that these innovations will not break the social sustainability of the science community, it will be valuable to develop a model of science as a tool for computer simulation of social consequences from possible innovations within virtual research environment. Focusing on possible social problems related to these new virtual research environments this short paper provides a brief analysis of the current situation in science (challenges, problems, main actors), general views on model of science (landscape, main agents, important properties, etc.) and on areas where simulation can contribute to better understanding of possible futures for the scientific community. © Copyright JASSS.","Agent Based Modeling, Science System Social Sustainability, virtual research environments",0,0,1,1
10.18848/2325-1212/cgp/v08i01/55304,The tropical data hub: A virtual research environment for tropical science knowledge and discovery,International Journal of Sustainability Education,2013,Article,"Tropical regions support some of the world's most diverse and unique ecosystems. However, these sensitive areas are under increasing pressures that significantly threaten their future sustainability. To help better manage tropical regions, a need exists for more informed environmental monitoring procedures. Currently, data is collected in disjoint repositories that are not visible or accessible for reuse. As data is not being publicised, there are missed opportunities for the holistic discovery of trends that influence tropical ecosystems. This paper presents the Tropical Data Hub as an e-research infrastructure to congregate significant tropical data sets for cross-domain analyses and knowledge discovery. The Hub serves as a focal point for the amalgamation of disparate data sources to facilitate data reuse, integration, searching, and correlation by environmental researchers and government departments for discovery and decision making. More suitable environmental management practices may then be devised via cross-disciplinary data that depicts a more accurate representation of the status. The system automates the data capture process and incorporates semantic technologies to provide knowledge discovery. We present two successful visualisation applications that demonstrate the Hub's capacity to enhance tropical environmental research. The first assesses land space use, and the second assesses potential impacts of climate change on global biodiversity. © Common Ground, Trina Myers, Jarrod Trevathan, Ian Atkinson, All Rights Reserved.","Environmental monitoring, knowledge discovery, Semantic technologies, Tropical biodiversity, virtual research environments",0,0,1,1
10.2196/13993,Development and evaluation of a virtual research environment to improve quality of care in overcrowded emergency departments: Observational study,JMIR Serious Games,2019,Article,"Background: Despite a wide range of literature on emergency department (ED) overcrowding, scientific knowledge on emergency physicians' cognitive processes coping with overcrowding is limited. Objective: This study aimed to develop and evaluate a virtual research environment that will allow us to study the effect of physicians' strategies and behaviors on quality of care in the context of ED overcrowding. Methods: A simulation-based observational study was conducted over two stages: The development of a simulation model and its evaluation. A research environment in emergency medicine combining virtual reality and simulated patients was designed and developed. Afterwards, 12 emergency physicians took part in simulation scenarios and had to manage 13 patients during a 2-hour period. The study outcome was the authenticity of the environment through realism, consistency, and mastering. The realism was the resemblance perceived by the participants between virtual and real ED. The consistency of the scenario and the participants' mastering of the environment was expected for 90% (12/13) of the participants. Results: The virtual ED was considered realistic with no significant difference from the real world with respect to facilities and resources, except for the length of time of procedures that was perceived to be shorter. A total of 100% (13/13) of participants deemed that patient information, decision making, and managing patient flow were similar to real clinical practice. The virtual environment was well-mastered by all participants over the course of the scenarios. Conclusions: The new simulation tool, Virtual Research Environment in Emergency Medicine, has been successfully designed and developed. It has been assessed as perfectly authentic by emergency physicians compared with real EDs and thus offers another way to study human factors, quality of care, and patient safety in the context of ED overcrowding. © 2019 JMIR Rehabilitation and Assistive Technologies. All rights reserved.","Emergency medicine, Interprofessional relations, virtual reality",0,0,1,1
10.22323/1.293.0015,Data Provenance Tracking as the Basis for a Biomedical Virtual Research Environment,International Symposium on Grids and Clouds,2017,Conference Paper,"In complex data analyses it is increasingly important to capture information about the usage of data sets in addition to their preservation over time to ensure reproducibility of results, to verify the work of others and to ensure appropriate conditions data have been used for specific analyses. Scientific workflow based studies are beginning to realize the benefit of capturing this provenance of data and the activities used to process, transform and carry out studies on those data. This is especially true in biomedicine where the collection of data through experiment is costly and/or difficult to reproduce and where that data needs to be preserved over time. One way to support the development of workflows and their use in (collaborative) biomedical analyses is through the use of a Virtual Research Environment. The dynamic and distributed nature of Grid/Cloud computing, however, makes the capture and processing of provenance information a major research challenge. Furthermore most workflow provenance management services are designed only for data-flow oriented workflows and researchers are now realising that tracking data or workflows alone or separately is insufficient to support the scientific process. What is required for collaborative research is traceable and reproducible provenance support in a full orchestrated Virtual Research Environment (VRE) that enables researchers to define their studies in terms of the datasets and processes used, to monitor and visualize the outcome of their analyses and to log their results so that others users can call upon that acquired knowledge to support subsequent studies. We have extended the work carried out in the neuGRID and N4U projects in providing a so-called Virtual Laboratory to provide the foundation for a generic VRE in which sets of biomedical data (images, laboratory test results, patient records, epidemiological analyses etc.) and the workflows (pipelines) used to process those data, together with their provenance data and results sets are captured in the CRISTAL software. This paper outlines the functionality provided for a VRE by the Open Source CRISTAL software and examines how that can provide the foundations for a practice-based knowledge base for biomedicine and, potentially, for a wider research community. Copyright owned by the author(s) under the terms of the Creative Commons","Computer Science - Software Engineering, software, business.industry, business, cloud computing, workflows, computer science, virtual laboratory, knowledge base, Process (engineering), grid, data science, virtual research environments",0,1,1,2
